{"closure_lineage_id":"lineage-closure-openai-gpt56-memory-boundary-replication-r1-2026-07","closure_lineage_sha256":"9a36d4556ede9df8c6926a56c98c4b09565a4f97e55b31ad9bf0741f7051fca3","closure_record_sha256":"ef519dc8cafb2cfa60eba183aa618770767f0fc3f662971876f5fce2117566fb","cohort_id":"openai-gpt56-memory-boundary-replication-r1","created_at":"2026-07-20T20:43:24+00:00","member_lineage_record_sha256":["a3ccb10907375b45fb097a83f25cb9abf8bdb04ef72532fdd5fe60c6b0283a49","02987f687f92efeb28c0eb961bdffe93c49e84088e9844f182cb16535c7a6815","3e6305c5d58307686e7bf987d51a92cfa52867e424bd14558b84110c194c5fd4","0d08b619a3a4738a4f924e5f350b39329f95b49defff294e8f474debbc968666","5410c8af5803bbfb3652b7fd827d1a0cb6f0fd962e2e1e27c341b048da93605d","39716a4f20e05445a932261244f3f681ce2f31445f0c91769fdd2116bc564e57","ce33caee951f5486799fb7087bad86c2c4c7afadabb19541f0274b74a668e27f","01e4ec7bc720a903074bd03c894696d16688468a2df0e1e4ca41c1e4f3cc61b2","36c139cff9bea560c15c775764ba765e5de2a1e9428768c4e39a07c51da95773","cf8742488be07c031081975ef6623267b97d333e15dd9e430f3340a597034e77","24d3c4454f8da4d01af31f72b85fe637c88ee4c62b3dd5f34deafac8de27137c","7515da795a472e949acdacdf92d8dd20bc23a1f62cfa2566866017a519a7327a","0dc2813d40635218526bffae6e3551987c11aa28f37e7a7bc9bce550f463ec50","ad257b92eb5132ea88e41dd07655376e86ece7e28f863d21fb4aaaea660a1183","aaa04951e8bbfd92d75f1860a5e17cf5b98732353a5c384341e760badd7fefd0","9e0ef16eea3973d6e1461141ba5959b7627a64236a300e6f341d2da63ab072ec","30f2276bc7d0c4f3873d2bb47e7cc4d4f5730bdf00f6f101bedfb5054999be6f","9d1b5a24f9e9ba505096c33715344575661b6a5740f93be9a5eaca027b0aca64","7cc35c1253067b73e0398cfd9e6ace3917e9172d1cbf3d2d6b510a74e591908d","00db2b2ef0a437c8ead3b202acbda21948b3a4f7baed05c855bfb20a1ebaafb7","ede4807b6be8322d4487dca53cefb8a3f288dba76fb82c8eb5f8e2aeb664d19a","1e6ff15ebc3c5b9653abedf08a52c66b666e8192f69ce564c68b473cfaf0269d","dd825648d79e29979a3767f034f8641c8d02bdde4dd057c1598f7083bd0e25ae","91d23d28afaefaf2364bcf6873facdfaa7ffc6f1f76133c88f78ce21699952df","ff1db1db17196caa68780a48ef5d07a6e5b1c122306c30ed3ff40b90f757c25f","c9c88a7cc755ed132a5174a59dc216b35b7034e3fc2eaaf60f03663e381f09fb","046d3b4b3e1b96c43d7932efda0020a0a8ab57b524d50ad94a0b7235efeeeb50","ffc7c82604b156f4257fe6dce63fa7cc9375f5e93c72dc6fa68e93b0513f01a3","af352f44401cb9f6054136f19ead755bee13e3b3cb88cd9252eb59e65ac4bd17","3dd254a20c4d0082388d0cd47fd09d0aaff6e5e46e93d1093f16f0ac2078145c"],"member_ratification_packet_sha256":["5d880fb44dc6e6f043cb65b99517a9a60329cb56be99b867b060c0616d25cabe","cbf758c9e673668a20d4e2ef66ea89cbf7a54dbd272631243cb24bf780f7db43","7ae72437b55cb1cae92cdabc9166c9c0e5c40a9d52cd22fdc89f5e00c3f8fe92","ee2fcba8b380df5e3f5e064d3ae171bd94d4bd403840b2532ddf7352eb11e251","0b2d4eebdaeb7fd1a4ba0c99078e40f2f985c439b60a95c4b5ba1ffcfdab0784","cdc40437d9ff71001751b29e60e3c566b658bacce09b819ac3fabbc46c6a5a45","677a2290f648bb79759c0f1293e87331b49f5ecce2000ae8c7336b85ae6e9989","9feffe184b8ad6e4a4b1bf52f7911d60237b21d0d10df435b86bf3d6ace82464","68ef82b15f415d42fdd0d319a5931a2bf082198954e092599bf19f11cf57f3bd","142bcac7dd5972efdf03bd4a99afcddb7035ea9c2c18ed600a8f9c32c837b029","168db574d74c098ffc33b8dbb0129ff211e5b1d9f505aef61c211983ccb10b83","099a4d2bb7ce1d18c9bf369f3b68d5e5ba7b7c41e22d5d7a303a4ce819f063a0","d658a9e2d0518deec724a5a57e78f3ff2dfc0d7a4b83cc6c63d172a8707defa1","98c296d507cb93fe6be8591ce9b8fa497a66ce34edce62c7924b8ba8c9b21ed1","0676fdf1dd4e02286c1195973c90db1dba737e6f968e814c71c00ef6a20c2778","c6b5ed85ed5516d225862aad9b86bf82b504ec458f412320e33e40f49fbc0f7c","bb521ebe80deb27ecfe6e31d87fe37f86b26e59d25e6e6b7a30db42c8891b278","121f70ee44fcc911125786abd10dbf2f53ed29b799c5cd576dbd203808fd50a4","c8bcddcb17d60e7ce69b0a4e7b7b9c3d1f53c45c76fe582361779188716af0bf","64669e1e2183705bc17a388a6ab4443378b5d1a42eb795aa9b0e2e471ebb7189","43309a7e14a6e6b0d4411d91cb753b067166e0f87d3fa0f1ff9d16722db6c5c2","e2f730fb9e31b01923fb9e693dad4b69159259bfee1bfe4c6982644d34207acf","665fea2955402f8a1cd8145962b2f0e1f3a9d83270fbf3409a8b946d60d028ba","73e659ff4eddede903c9f742a9dfaeadfa7e76098981e6a37634d40afddaf531","48227dbcf825265612543c4567b558b93b750108ecdfda90e1b05f1a6bf217b8","57aa1a28be4691c22c775955baceb1b9c236fe35f0923f42d0fee5941bf99681","b558c3460d31d7ad27c0780b2a7748cab06ee790f581515b72e03a9fefdda2a6","acc1beb2898baa91a783f14ce96840e41f5c320526789c494aa1d57dd71956f0","cf62b99f51420def2d8f72a287be6d121a487616c5e1de4d08879d71e873229e","d4e96cd08003d6700f833617c0f341132b2a6eee0fb5b595dc2a023d2731f6f4"],"outcome":{"capture_mutation_effect":"none","class":"COHORT_LINEAGE_RECORDED","promotion_effect":"none","publication_effect":"none","ranking_effect":"none","ratification_mutation_effect":"none","release_effect":"none"},"schema_version":"sfa_bench.campaign_capture.cohort_closure_lineage.v1"}