{"closure_lineage_id":"lineage-closure-openai-gpt56-sol-memory-boundary-r2","closure_lineage_sha256":"a5bf677b089e2101235ebf69521f66ccb93c76bc99e9dc3a7f6f2275fe9f2101","closure_record_sha256":"42fccd9a37c48aee23c24731518cb4df243abdcc96dba4c33d668944d04f0e0e","cohort_id":"openai-gpt56-sol-memory-boundary-r2","created_at":"2026-07-24T18:46:16+00:00","member_lineage_record_sha256":["5fb136345f987cc730f40291ddf83479a8dca22175e481aff7e4fc65dc205e8a","0fea6cd9ca76ff2d20b666b641ccea6bd4d2f8d4500714ba97f448f5156e77c9","93ae9d9e841714cc718798703552a86ddff6674965cacf5739ae6767680fec9c","ceb2aa342336c870602a16bbdf070a95849b694b5d63c857002a833dc8538e1e","a6db148589ff7252216433f2f5c06dcf75e8db78f51ef1eef8509ba06210ced8","829c17f6ae4f6cc4fafc0a3743c57c54c852bed0eb217a7bc70956a193a3adb9","accf630a1d5ea81729277f8c82cb3caa9329e987eaa28c66752e17578f30d9ab","6c3ecba6dd5f374500eec3bfd359b61bcbd0ed601b6f942a71f4ca30c438e829","27517e2a83b671dac63a28a7481bcdb15345217323d268ea9d363e4460dc8b78","2059203cd67d48d44c222120faeb38b18bd497fb585318ed0c34aecdebbf3bdc","b39ddeb9696c0c47d37752f77b475dc8f7cba0e67968f381928cd12c36be9c7b","45a1474fc285a69b5aaf60fe703b205ba1c4ee5a2bb3b7abbfcca096e26237ff","845fb91172dab8f70b3593417ca4ba79d09f98c6b3eace9cb39e63a9767e8277","2ab685c901336a3f18c05f6fc6f50e147ede8808dec42064046a4b5debc8e3d1","d4a95a2550d2f1cda220793daa0ea1ade3ca6df88b5ade8100a01669817b09c2","ac34f21f2389b9d6e2ec6fd47710736f7ac38e540591902ecd49b15eaf693246","2257fe542b4b0498db00f656f76ac2590b1e4031e806eb7e76f9c64ca1ac093d","35092ceea2592f0999a93a3978d7121c13f2012dc8c7632e03ca46a7db90d813","09be9c926841479c1aa8ba2602e5346c722b6393238db2cd01893a470c69326b","3dc194256cadfafedb6b2b71dad31f11a5ac2554006fd410ba1a6d7133f90a46","7e4b78c684833a64cffa9e9e3f5675d516d1a52d9277c16a9a49444a50163796","15558cecb90b6d550abc45fe1c7984e6e5c4cd7e6e02d731028fa5ff9a236186","9c8156ca17dbc5d14105edb9ae317253720a7cb53c0f88d5908ff6b4f467add5","adce0e0e4382b309e1008354a3e32ed0d83b7204d285829570dced79650d5c96","b689f6bc3bafd86d2a6f387d1bea8a1e3ef5873ae612e2783e561997fb1c1ada","4542575c1f4b3595e2376bece8f1b00dd8e83fba34c44ea913a65fe717c88718","7e17f325f830c07f65a80ce87807c209d5958aa1d8d2346c299f8d4665f020e0","5864ed04ec9d30860665a6123eac724ba0e41f05a6f2bd78a996fec6a991f38b","d1dac84954504a5c4b678b59976ddfc6e5b43b8575ccc6903a3948aae1e77295","6db0946d615f004159d69344ab8de926548604d6b00981fdc446d8f582d4e4b9","029f9f3bbb8fe102ce97eeb518ccb472b205750c8729fa4ad283255edadf2447","d28ab6809154ea76d68f18a133999ce7c5cf89e693f3442dafcacb068749d44e","3159caae2a02d71d3ff806ba7795dec5e1916f92bcdcfd52358b345a063d75a7","9f9b986e2ce35a31e6a66f669cf88c9fbbf3d9d60d79e72f65666d782091379c","c6352bbb40cc5da4d6f21f3504758ddcda35ff4d5aec4a3e61f0c16466e351a0","1f8581943da3b598f41b3ffcfa91e93fa275cc4441276f06790ac675cf895b4b","786c8ac227375b52be77d648c6cf1ac39cd7c3a836891ba77b608e56e3e8cf98","d9236e5bd0573cec1b6d13cd6419344e03b8df53d58bf58be79cdc3b6643857c","b7b75f4a47cbffcf99c2f85f252b4b899b84ae3890f9d1cd46f0c82dcce01360","ffbe1f1aacc80b286e5fe7d6a72ccad4e6ab7215238150136fbeebdd0513c76f","ccf1d468742a00a4ededb496eaefd101c5521df3976e49bd408351acf0da33fa","519dfad805bd3b8f6f1e79f4563f315135aecd1588aba812cf767c2e74be144c","3a9bbbe161b1e074d754a52aa93f34cbadff259f3f6f01e7ba08ee10e97d033f","ce4f9d649536a79d8e1e602cfaf2efdf70ba21ccbc8104f341dcaedd6c49faa1","e456f083a9951c321f4ca41e7a59ffa0fcc6bc2ddc1c64c07ce4a542fb36a795","be086a0a6f125ba1e9e4ba792527ca51a914a89d36eb4b3b8300fcaf1b62e12e","82efcea843095f864ee78bc89be4c5abbb87500970ad375a56f4dafc41b09803","a86c88af1f455fb37e3752d080b17c213b17c7b5b4fce3c906ff8717bf0303c4"],"member_ratification_packet_sha256":["8e461461539ab0fb59d2020a29d55fc61daefc5ba980cc2b393776c4ec08db48","812466d51e0fd57260eb11182ddfdb72d56ad98b5a4e9a2333a6541991bbb52c","92068af52ee8631837e4e0697250fa821b8f2fbfbc54612abb15fe06f95dc77c","1de4dcb9505c3579fa39922973ebc566096c1d12ce004fafc8e3e929126279c8","5dade3a5db9c5c67cc805e2f9bcda7239621b20bb65a85c7f2b59e140ad42a55","63b5d8efd3180884bec4a7e251c52bdc39d4fadcc1c99592a201dedfa53dcd62","834b796b5e50b1b4d628f3877cdf1edb6f613b93017d03688988c2e6089ea3c3","6236668039e14a05c23a5a5b4cfba3bd1c467c41a3b2fec9edd2f31882766ef2","5a46ec6c95bce5ce38520e9a4090d52bf97ffd04b3f31ad8317c045f20cbf876","d28c9d71a027aa429ac6bb7598fcdb06096202046c007cfdc531ad9575985914","2cb507b1eb3c523882b1d2dc351dd367561b7999d8baf1ea20cb8c4ef2d29601","7530a8ea761c4f943588f40422cfe0a86f8cf1b147edaa6e58fa6201c0002f6a","9b85d76ee5bb8cb8d17eee67d75a2a9c884b1673ba92e294e107c0ed9503b913","2986d1b44c9ee2be385a20d25712ddc77c504e66b7c938c352bdfe072c4fa139","3b70e3bd7367dd699d8daf8b9b9d5ce8fa2c8c23f654c81bf76bea50cb64a922","899dcf93ac6095333be0f96900dda886da1909b045566431e009007433abca95","88df07796d72234897749109bce9f267e24daf40acd49fcb0b48d691e4c1c472","938521f465ae3a83861ad7c0ebe19b4bba0c78a6585d12136fc8bc75a13d31ae","764db30d556f1f5a85e66ae0648d1cf1c791e659803b2607067412584bd789b5","e2bf28198243084fb7998dc1d95f3437f419466969a09531c99d1732d5150b3d","9e38619129c20bfac96979d0208e654597e9d15a30a2a50a462ac4acc6dbd48a","1097cc246dc0278c79aa8c31a77b3687b4d5200f34a191bc215bfa91e6046053","593733c8e8f12febde5a46b3178280eb52556db7ff698747ec1698b2b12bd40c","9b4fb1eefe4b7a8781acb48064bd5226b91014927421a9ef8f4869ebc9d1568a","388427429b74aa1c78f4adb1518e42760e0be1a7f707a68913f0b93ebe611dcc","f2822fbb37c094d389ba35f6158396167aad2cd1ad84256d7e42eb74449704a4","5a8eb0d39986f51fc850acdf3cf99dccacf5ec21bdd3249dc635150f37937fe3","da64f4196f4cd8588d7cbe88529bc1a5168ee3d33eece4b4a2ed5cf465d71bb8","69b14e9516b5666dfe77efc6ff9e86b7f2d1045567cf9b5465408100ac61f9ea","130a5ba959e2b813f0b099707a70c7fcdb41ca30ff6ce41c675d1ae9e91366ea","1aefe64a65d602cd492e369c55c92407e7502cd22d593a3937663903e3aca25f","37df6ddc6e2f27f81db5d13923c9fc136ea016aa9d9eb46030b9c506abcd0aa9","c248e4d5dd7863d5897263e0796ae7d97c91372a6b88fbd62fa22012b60e3fd7","76813f191bb7048c50aa91a4c1ac8e0aaec3b14a18462c4cfcd0caaef3326350","436dafd2734a5b8b50a063d0f3fce228cd7d15370732cf78d044021a53a4ebde","337123db34454c50898fe3e6e49956c2e62cdd57d1d21ff44cbe3864f3e98391","7837f68ff17c45b42ceb535c9d3685d4cb8db9f9c2127a3aa16f447a0b1bd059","d53a11dbda1e1dbce815e1f5266432344cb6f481a3b8cd816991ec49d9e2d3e7","f21707f3ab6fbe1b9af97e073f843b492a82fee741f4695e54386bef7da22fc7","c9833d203640ecc3cef737f4c1ce160fd09382b0d85492fa3b66ef4b25bc8628","879a6b5252236d0857a71f088ec5979bab71dce662306448d12cc96feeafb9b0","6217663c16e7d8a567f190e19684afc5b187a8710538e5dac7b37cec4039bea9","54d02ef872de29b2088ae6273c11cd08db621beeea0770f2df214bf555ac1cc1","0a803adba2f05399783b9a1e604b9eb914047853ad369f5b1e35169677b2ef71","cef93648803480b74e5c04c1c358baae99204c3c20075708db8e054bdfdae73b","665af52c684efff63d1a6adf33f84929195ac3df437c4e0c0059110905ecee10","411e5ad8dd9dffa5dc0f0a2e2ff230339c2c7515f0f994bac9d4c1aa3600e0e0","a50a0be8e084561ebf63f243002e7fa2d703f3a9ee41bb3c3ab7e50e2c00d787"],"outcome":{"capture_mutation_effect":"none","class":"COHORT_LINEAGE_RECORDED","promotion_effect":"none","publication_effect":"none","ranking_effect":"none","ratification_mutation_effect":"none","release_effect":"none"},"schema_version":"sfa_bench.campaign_capture.cohort_closure_lineage.v1"}